<?xml version="1.0" encoding="utf-8"?>
<jxhl xmlns="http://halo-studio.com/jxhl" xmlns:xsi="http://www.w3.org/2001/XMLSchema-instance" xsi:schemaLocation="http://halo-studio.com/jxhl ../js/jxhl.xsd">
    <panel dock="bottom" height="51" border_width="1,0,0,0" css_name="text-center" css_text="border-top:1px solid #e8e9e9; background:#f8f9f9; line-height:50px; overflow:hidden;">
        <html dock="fill">
           
        </html>
    </panel>
    <html dock="fill" css_name="app-scroll">
        <div class="container">
            <div class="form">
                <div class="form-group">
                    <h2>登录</h2>
                </div>
                <div class="form-group">
                    <input local_var="txt_mobile" type="text" class="form-control" placeholder="手机"/>
                </div>
                <div class="form-group">
                    <input local_var="txt_pwd" type="password" class="form-control" placeholder="密码"/>
                </div>
                <div class="form-group">
                    <button local_var="btn_signin" type="button" class="btn btn-primary">登录</button>
                </div>
                <div class="form-group text-center" local-id="div-msg"></div>
            </div>
        </div>
    </html>
    <runnable>
        <![CDATA[
            
        ]]>
    </runnable>
</jxhl>